"row_num","review_id","id","contract","clause_type","clause_text","category","disagreement_type","disagreement_direction","label_gap","clause_risk_profile","typical_risk_for_type","qwen_label","gemini_label","copilot_label","qwen_confidence","gemini_confidence","qwen_reason","gemini_reason","final_label","reviewer","notes"
5162,"MR-135","EdietsComInc_20001030_10QSB_EX-10.4_2606646_EX-10.4_Co-Branding Agreement__Minimum Commitment","EdietsComInc_20001030_10QSB_EX-10.4_2606646_EX-10.4_Co-Branding Agreement","Minimum Commitment","During the Term, eDiets.com will be guaranteed 12 million circulation per year from and after the Effective Date via newsletters, including but not limited to:      >>  Fashion & Beauty Newsletter: 300,000 subscribers per month      >>  Food News: 180,000 subscribers per month      >>  Prevention: 1,600,000 subscribers per month      >>  Internet Scopes:  2,400,000 subscribers per month      >>  Sex & Romance: 120,000 subscribers per month      >>  What's New: 1,100,000 subscribers per month      >>  Women.com Member Newsletter: 1,700,000 subscribers per month

Guaranteed Circulation Per Year:            12,000,000","MANUAL_REVIEW","LOW\u2194HIGH","Qwen\u2191",2,"context-dependent \u2014 dollar value matters","HIGH (40%)","HIGH","LOW","Medium",0.95,1,"The clause imposes a strict, non-negotiable minimum volume obligation (12 million circulation) on the signing party (eDiets.com) without any stated remedies, caps, or conditions for failure to meet the target, creating significant financial and operational liability if the guaranteed subscriber numbers are not achieved.","This clause guarantees a minimum circulation for eDiets.com, which is the signing party (the counterparty to the drafter). This is a benefit to the signing party, ensuring they receive a certain level of exposure, rather than imposing a minimum purchase commitment on them.","LOW","Sachin","Agreed with Gemini reasoning."
5163,"MR-136","EhaveInc_20190515_20-F_EX-4.44_11678816_EX-4.44_License Agreement_ Reseller Agreement__Minimum Commitment","EhaveInc_20190515_20-F_EX-4.44_11678816_EX-4.44_License Agreement_ Reseller Agreement","Minimum Commitment","Notwithstanding anything to the contrary contained herein, the exclusive appointment and license set out in Sections 2(a) and 2(b) shall become non-exclusive if:","MANUAL_REVIEW","LOW\u2194HIGH","Qwen\u2191",2,"context-dependent \u2014 dollar value matters","HIGH (40%)","HIGH","LOW","Medium",0,0,"The clause allows the drafter to unilaterally strip the signing party of their exclusive rights without specifying any minimum performance thresholds or notice periods, creating significant uncertainty and potential loss of market position for the signing party.","This clause indicates a condition under which an exclusive arrangement would revert to non-exclusive. Without the specific conditions, it's impossible to assess the risk fully. However, the clause itself does not impose a minimum commitment or purchasing obligation on the signing party. It merely states a potential change in the exclusivity status, which is a common contractual mechanism for performance-based agreements. It does not directly create a financial obligation or minimum purchase requirement.","LOW","Sachin","Agreed with Gemini reasoning."
5164,"MR-137","FIBROGENINC_10_01_2014-EX-10.11-COLLABORATION AGREEMENT__Minimum Commitment","FIBROGENINC_10_01_2014-EX-10.11-COLLABORATION AGREEMENT","Minimum Commitment","In the event generic equivalents has captured the [ * ] of the quantity of Lead Compound sold by Astellas during the [ * ] preceding such termination calculated on a annual basis; or in the event, after the entry into the market of generic equivalents, that Astellas' annual sales fall below $[ * ] for all Lead Compounds, Astellas may terminate this Agreement upon [ * ] written notice to FG; provided, that Astellas does not Commercialize any Lead Compound after such termination until the expiration of the last to expire FG Patents applicable to such Lead Compound.","MANUAL_REVIEW","LOW\u2194HIGH","Qwen\u2191",2,"context-dependent \u2014 dollar value matters","HIGH (40%)","HIGH","LOW","Medium",0.85,0.9,"The clause grants the drafter (Astellas) unilateral termination rights triggered by generic market entry or sales thresholds, while imposing a post-termination non-commercialization restriction on the drafter that lasts until patent expiration. This creates a significant risk for the signing party (FG) because the termination is triggered by market forces (generic competition) rather than FG's performance, and the restriction prevents FG from potentially licensing or selling the compound to others during the patent term, effectively locking FG out of the market for the duration of the patents without compensation or recourse.","This clause outlines conditions under which Astellas (the counterparty to FG) may terminate the agreement. From FG's perspective, this clause provides Astellas with termination rights based on market conditions (generic equivalents capturing market share or sales falling below a threshold). However, the critical protection for FG is the proviso that Astellas cannot commercialize any Lead Compound after termination until the expiration of FG's patents. This significantly mitigates the risk for FG, as it prevents Astellas from terminating and then immediately competing with FG's patented compounds, ensuring FG retains value from its intellectual property even after Astellas's termination.","HIGH","Sachin","Agreed with Qwen reasoning."
5165,"MR-138","GOCALLINC_03_30_2000-EX-10.7-Promotion Agreement__Minimum Commitment","GOCALLINC_03_30_2000-EX-10.7-Promotion Agreement","Minimum Commitment","PageMaster Corporation shall provide a minimum of 100,000 up to                500,000 pagers for the fulfillment of this promotion to all                Purchase Customers who prepay their annual airtime.","MANUAL_REVIEW","LOW\u2194HIGH","Qwen\u2191",2,"context-dependent \u2014 dollar value matters","HIGH (40%)","HIGH","LOW","Medium",0.9,1,"The clause imposes a mandatory minimum purchase obligation of 100,000 units on the signing party (Purchase Customers) without specifying a corresponding penalty for failure to meet this target or a mechanism to adjust the commitment based on actual demand, creating significant financial exposure for overstocking or unsold inventory.","This clause describes a minimum commitment from the counterparty (PageMaster Corporation) to provide pagers, not a minimum commitment from the signing party to purchase them. This is favorable to the signing party as it guarantees a supply without imposing a purchase obligation.","LOW","Sachin","Agreed with Gemini reasoning."
5166,"MR-139","HYPERIONSOFTWARECORP_09_28_1994-EX-10.47-EXCLUSIVE DISTRIBUTOR AGREEMENT__Minimum Commitment","HYPERIONSOFTWARECORP_09_28_1994-EX-10.47-EXCLUSIVE DISTRIBUTOR AGREEMENT","Minimum Commitment","Developer may cancel this Agreement if the total gross annual software revenue does not meet DeVeloper's revenue forecast for the Distributor, such cancellation to be eftected by written notice delivered to Distributor not later than 30 days after any Developer's Fiscal Year end (June 30).","MANUAL_REVIEW","LOW\u2194HIGH","Qwen\u2191",2,"context-dependent \u2014 dollar value matters","HIGH (40%)","HIGH","LOW","Medium",0.95,0.9,"The clause grants the drafter (Developer) unilateral termination rights based on an internal forecast rather than objective performance metrics, creating significant uncertainty and potential for arbitrary cancellation for the signing party (Distributor).","This clause describes a right of the Developer (the counterparty) to cancel the agreement if revenue targets are not met. From the perspective of the Distributor (the signing party), this is a standard performance-based termination right for the counterparty and does not impose a minimum commitment or penalty on the Distributor. It simply means the agreement might end if the Distributor's sales performance is insufficient, which is a common and generally acceptable risk in distribution agreements.","LOW","Sachin","Agreed with Gemini reasoning."
5167,"MR-140","HealthcentralCom_19991108_S-1A_EX-10.27_6623292_EX-10.27_Co-Branding Agreement__Minimum Commitment","HealthcentralCom_19991108_S-1A_EX-10.27_6623292_EX-10.27_Co-Branding Agreement","Minimum Commitment","MLX will use all commercially reasonable efforts to maintain the user traffic at a monthly minimum of:

 .  [*] page views three (3) months after the launch of the Co-Branded Site;

 .  [*] page views six (6) months after the launch of the Co-Branded Site; and

 .  [*] page views twelve (12) months after the launch of the Co-Branded Site.","MANUAL_REVIEW","LOW\u2194HIGH","Qwen\u2191",2,"context-dependent \u2014 dollar value matters","HIGH (40%)","HIGH","LOW","Medium",0.85,1,"The obligation is placed on the signing party (MLX) to guarantee a specific traffic volume, which is typically outside their direct control and dependent on third-party user behavior. While the standard is 'commercially reasonable efforts,' tying contractual performance to a specific, escalating traffic target creates significant exposure for breach of contract if market conditions or user adoption fall short, effectively functioning as a hard minimum commitment with limited recourse.","This clause places a 'commercially reasonable efforts' obligation on the counterparty (MLX) to maintain minimum user traffic, which is a benefit to the signing party. It sets performance expectations for the counterparty rather than imposing a minimum commitment on the signing party, thus reducing risk for the signing party.","HIGH","Sachin","Agreed with Qwen reasoning."
5168,"MR-141","IGENEBIOTECHNOLOGYINC_05_13_2003-EX-1-JOINT VENTURE AGREEMENT__Minimum Commitment","IGENEBIOTECHNOLOGYINC_05_13_2003-EX-1-JOINT VENTURE AGREEMENT","Minimum Commitment","Subject to the provisions of Article 6.1, the Operating Company shall annually declare and pay by March 15 a distribution to each Party equal to the larger of the two estimated annual tax liabilities as reflected on the approved Party Tax Estimates (the ""Minimum Distribution"").","MANUAL_REVIEW","LOW\u2194HIGH","Qwen\u2191",2,"context-dependent \u2014 dollar value matters","HIGH (40%)","HIGH","LOW","Medium",0.95,0.9,"The clause imposes a mandatory financial obligation on the Operating Company to pay a 'Minimum Distribution' based on tax liabilities, which functions as a guaranteed minimum payment regardless of actual profitability or cash flow. This creates significant financial exposure by forcing the signing party to fund distributions even if the entity has no earnings, effectively prioritizing the counterparty's return over the company's financial health.","This clause describes a minimum distribution that the Operating Company must pay to each Party, which is beneficial from the perspective of the signing party (as a recipient of the distribution). It ensures a minimum payment tied to tax liabilities, which is a common and reasonable mechanism in such agreements to cover tax obligations.","HIGH","Sachin","Agreed with Qwen reasoning."
5169,"MR-142","IVILLAGEINC_03_17_1999-EX-10.16-SPONSORSHIP AGREEMENT__Minimum Commitment","IVILLAGEINC_03_17_1999-EX-10.16-SPONSORSHIP AGREEMENT","Minimum Commitment","However, if iVillage falls to deliver the advertising          impressions during the Promotion Period and FMM desires that iVillage          ""make good"" the undelivered impressions and extend the Initial Term          pursuant to option (a) set forth in Section 2.C.(iii), if the Parties          have decided not to renew the Initial Term and iVillage desires to          enter into an agreement with an entity whose business(es) would pose a          conflict to FMM","MANUAL_REVIEW","LOW\u2194HIGH","Qwen\u2191",2,"context-dependent \u2014 dollar value matters","HIGH (40%)","HIGH","LOW","Medium",0.85,0.9,"The clause creates a conditional restriction on the signing party (iVillage) entering into agreements with conflicting entities, effectively acting as a non-compete triggered by the counterparty's (FMM) desire to extend the term. This imposes a significant business limitation on the signing party's ability to operate or partner with others based on the counterparty's strategic interests, which is a heavily one-sided and unusual term for a minimum commitment context.","This clause does not establish a minimum commitment for the signing party (FMM). Instead, it addresses a scenario where the counterparty (iVillage) fails to deliver, and FMM has the option to request a 'make good' and extend the term. This provision is favorable to FMM as it provides a remedy for non-performance by iVillage, rather than imposing an obligation on FMM.","LOW","Sachin","Agreed with Gemini reasoning."
5170,"MR-143","LeadersonlineInc_20000427_S-1A_EX-10.8_4991089_EX-10.8_Co-Branding Agreement__Minimum Commitment","LeadersonlineInc_20000427_S-1A_EX-10.8_4991089_EX-10.8_Co-Branding Agreement","Minimum Commitment","VerticalNet agrees to guarantee that, during the initial Term of this Agreement, LeadersOnline shall earn LeadersOnline- VerticalNet Revenue of at least *** Dollars ($***) (the ""Guaranteed Amount""), subject to the provisions of this Section 6.5  [Guaranteed Revenues].","MANUAL_REVIEW","LOW\u2194HIGH","Qwen\u2191",2,"context-dependent \u2014 dollar value matters","HIGH (40%)","HIGH","LOW","Medium",0.95,1,"The signing party (VerticalNet) assumes an absolute financial guarantee to ensure the counterparty earns a specific revenue amount, creating significant liability exposure if market conditions or performance fall short, regardless of VerticalNet's actual control over the revenue generation.","This clause represents a minimum revenue guarantee from VerticalNet to LeadersOnline. From the perspective of LeadersOnline (the signing party in this scenario, as the recipient of the guarantee), this is a favorable term as it ensures a minimum income stream, reducing their financial risk.","LOW","Sachin","Agreed with Gemini reasoning."
5171,"MR-144","Reinsurance Group of America, Incorporated - A_R REMARKETING  AGREEMENT__Minimum Commitment","Reinsurance Group of America, Incorporated - A_R REMARKETING  AGREEMENT","Minimum Commitment","On the third Business Day immediately preceding the Remarketing Settlement Date (the ""Remarketing Date""), the Remarketing Agent shall use  its commercially reasonable efforts to remarket the Remarketing Securities, at a price at least equal to:

(i) 100% of the aggregate Accreted Value thereof as of the end of the day on the day next preceding the Remarketing Settlement Date; or

(ii) on the Maturity Remarketing Date, 100% of the stated liquidation amount of the Preferred Securities or the principal amount at maturity of  the Debentures, as the case may be.","MANUAL_REVIEW","LOW\u2194HIGH","Qwen\u2191",2,"context-dependent \u2014 dollar value matters","HIGH (40%)","HIGH","LOW","",0.85,1,"The clause imposes a strict price floor guaranteeing 100% recovery of accreted value or liquidation amount, which effectively transfers all market risk to the signing party (likely the issuer or investor) by mandating a specific outcome that may be impossible to achieve in a downturn, creating significant financial exposure without standard market protections.","This clause describes the Remarketing Agent's obligation to remarket securities using 'commercially reasonable efforts' and sets a minimum price. It does not impose any minimum purchase commitment or order size on the signing party (the counterparty to the drafter). Therefore, from the perspective of the signing party, there is no direct risk related to minimum commitments.","LOW","Sachin","Agreed with Gemini reasoning."
5172,"MR-145","STWRESOURCESHOLDINGCORP_08_06_2014-EX-10.1-COOPERATION AGREEMENT__Minimum Commitment","STWRESOURCESHOLDINGCORP_08_06_2014-EX-10.1-COOPERATION AGREEMENT","Minimum Commitment","For purposes of this section, the Post-Well Study must show that the Existing CRA Well or Replacement CRA Well can produce CRA water at a minimum of 1,200 GPM or more or a combination of 1,200 GPM from one or more wells on the Property in order for STW to proceed with the obligations set forth in this section (""Critical Criterion"").","MANUAL_REVIEW","LOW\u2194HIGH","Qwen\u2191",2,"context-dependent \u2014 dollar value matters","HIGH (40%)","HIGH","LOW","Medium",0.9,0.9,"The signing party's obligation to proceed with the contract is strictly conditioned on achieving a specific, high-volume production threshold (1,200 GPM) that is outside their direct control if dependent on geological factors; failure to meet this 'Critical Criterion' likely results in the drafter (STW) terminating obligations, leaving the signing party with no recourse or benefit despite potential investment.","This clause sets a minimum production threshold for the well, which is a condition for STW to proceed with its obligations. From the perspective of the party signing the contract (the counterparty to STW), this is a protective measure ensuring that STW only proceeds if the well is sufficiently productive. It acts as a safeguard rather than a burden or commitment on the signing party.","LOW","Sachin","Agreed with Gemini reasoning."
5173,"MR-146","SUNTRONCORP_05_17_2006-EX-10.22-MAINTENANCE AGREEMENT__Minimum Commitment","SUNTRONCORP_05_17_2006-EX-10.22-MAINTENANCE AGREEMENT","Minimum Commitment","Any one or more of the following events shall constitute a ""Maintenance Event of Default"" under this Agreement:","MANUAL_REVIEW","LOW\u2194HIGH","Qwen\u2191",2,"context-dependent \u2014 dollar value matters","HIGH (40%)","HIGH","LOW","Medium",0.95,0.9,"The clause defines a 'Maintenance Event of Default' but fails to specify the actual events or minimum commitment thresholds required to trigger it. This creates significant legal uncertainty and exposes the signing party to default claims based on undefined or unspecified criteria, which is a critical omission in a contract defining default conditions.","The provided text only defines what constitutes a 'Maintenance Event of Default' without specifying the actual events. It does not contain any language related to minimum commitments, order sizes, or units. Therefore, from the perspective of a minimum commitment clause, this text presents no risk.","LOW","Sachin","Agreed with Gemini reasoning."
5174,"MR-147","TEARDROPGOLFCO_10_23_1996-EX-10.12-ENDORSEMENT AGREEMENT__Minimum Commitment","TEARDROPGOLFCO_10_23_1996-EX-10.12-ENDORSEMENT AGREEMENT","Minimum Commitment","TPC shall have the right to prorate the  Retainer Fee due Consolidated Artists upon fourteen (14) days written notice  to Consolidated Artists or Advantage in the event Ogle fails to play a  minimum of seventeen (17) U.S. PGA","MANUAL_REVIEW","LOW\u2194HIGH","Qwen\u2191",2,"context-dependent \u2014 dollar value matters","HIGH (40%)","HIGH","LOW","Medium",0.9,0.9,"The clause imposes a strict minimum performance obligation (17 PGA events) on the signing party (Ogle) with the sole consequence being a fee proration right for the drafter. This creates significant financial and operational risk as the signing party is locked into a high-volume commitment without reciprocal protections or clear definitions of what constitutes 'playing' or force majeure exceptions, potentially leaving them liable for the full retainer if they fall short.","This clause describes a condition under which the counterparty (TPC) can reduce a fee owed to the signing party (Consolidated Artists) if a third party (Ogle) fails to meet a minimum playing commitment. From the perspective of the signing party, this is a risk mitigation for the counterparty, not a minimum commitment imposed on the signing party. The signing party is not obligated to buy anything, but rather faces a potential reduction in payment if a third party's performance falls short. This is a standard mechanism to adjust fees based on performance metrics, and does not impose a purchasing obligation on the signing party.","LOW","Sachin","Agreed with Gemini reasoning."
5175,"MR-148","TICKETSCOMINC_06_22_1999-EX-10.22-SPONSORSHIP AGREEMENT__Minimum Commitment","TICKETSCOMINC_06_22_1999-EX-10.22-SPONSORSHIP AGREEMENT","Minimum Commitment","MP3.com agrees to deliver a guaranteed minimum of 3,000,000 Impressions per month for the term of this Agreement.","MANUAL_REVIEW","LOW\u2194HIGH","Qwen\u2191",2,"context-dependent \u2014 dollar value matters","HIGH (40%)","HIGH","LOW","Medium",0.95,1,"The signing party (MP3.com) assumes an absolute, non-negotiable obligation to deliver a specific volume regardless of actual demand or market conditions, creating significant financial and operational liability if the target is not met.","This clause establishes a minimum commitment from the counterparty (MP3.com) to the signing party, ensuring a guaranteed delivery of impressions. This is favorable to the signing party as it guarantees a certain level of service or product, reducing the risk of under-delivery.","HIGH","Sachin","Agreed with Qwen reasoning."
5176,"MR-149","TheglobeComInc_19990503_S-1A_EX-10.20_5416126_EX-10.20_Co-Branding Agreement__Minimum Commitment","TheglobeComInc_19990503_S-1A_EX-10.20_5416126_EX-10.20_Co-Branding Agreement","Minimum Commitment","theglobe shall provide a minimum of *** impressions per month of promotion for auctions on the Co-Branded Pages (including without limitation any of the foregoing).","MANUAL_REVIEW","LOW\u2194HIGH","Qwen\u2191",2,"context-dependent \u2014 dollar value matters","HIGH (40%)","HIGH","LOW","Medium",0.85,0.9,"The clause imposes a mandatory minimum performance obligation on the drafter (theglobe) rather than the signing party. While this appears favorable to the signing party as it guarantees a baseline of service, the specific risk lies in the ambiguity of the placeholder '***' and the lack of defined consequences or remedies if the drafter fails to meet this minimum. If the signing party is the customer relying on these impressions, the absence of explicit penalties for non-delivery or a clear definition of 'impressions' creates significant exposure to underperformance without recourse, making the term risky despite the apparent benefit.","This clause establishes a minimum commitment from the counterparty (theglobe) to provide a certain level of service (impressions). From the perspective of the signing party (the customer/licensee), this is a favorable term as it guarantees a minimum level of performance or delivery, reducing the risk of under-delivery by the counterparty.","LOW","Sachin","Agreed with Gemini reasoning."
5177,"MR-150","USASYNTHETICFUELCORP_10_21_2010-EX-10.10-STRATEGIC ALLIANCE AGREEMENT__Minimum Commitment","USASYNTHETICFUELCORP_10_21_2010-EX-10.10-STRATEGIC ALLIANCE AGREEMENT","Minimum Commitment","Global Energy securing one or more firm written commitments in form and substance reasonably acceptable to Oxbow for at least Two Hundred Seventeen Million and No/100 Dollars ($217,000,000.00) of equity funding for the Lima Project, or in the alternative, evidence demonstrating that Global has available cash of Two Hundred Seventeen Million and No/100 Dollars ($217,000,000.00) in its account.","MANUAL_REVIEW","LOW\u2194HIGH","Qwen\u2191",2,"context-dependent \u2014 dollar value matters","HIGH (40%)","HIGH","LOW","Medium",0.95,1,"The clause imposes a massive, specific financial obligation of $217 million on the signing party (Global Energy) to secure external equity funding or prove cash availability. This creates significant exposure as failure to meet this exact threshold likely constitutes a material breach, potentially terminating the agreement or triggering penalties, without clear flexibility for market conditions or partial performance.","This clause describes a minimum commitment that Global Energy (the counterparty to Oxbow) must meet, either through equity funding or available cash. From Oxbow's perspective (the signing party), this is a favorable term as it ensures a significant financial commitment from Global Energy, reducing Oxbow's risk regarding the project's funding. It does not impose a minimum commitment on Oxbow.","LOW","Sachin","Agreed with Gemini reasoning."
5178,"MR-151","WARNINGMANAGEMENTSERVICESINC_12_10_1999-EX-10-ENDORSEMENT AGREEMENT__Minimum Commitment","WARNINGMANAGEMENTSERVICESINC_12_10_1999-EX-10-ENDORSEMENT AGREEMENT","Minimum Commitment","Pey Dirt has the right to terminate this Agreement immediately if Company's Endorsed Products are not being distributed in the Contract Territory to a significant number of stores by October 1, 1999.","MANUAL_REVIEW","LOW\u2194HIGH","Qwen\u2191",2,"context-dependent \u2014 dollar value matters","HIGH (40%)","HIGH","LOW","Medium",0.9,0.9,"The clause grants the drafter (Pey Dirt) unilateral termination rights based on an undefined performance metric ('significant number of stores') with a fixed deadline, creating immediate and disproportionate exposure for the signing party without cure periods or objective standards.","This clause grants the counterparty (Pey Dirt) a right to terminate if distribution targets are not met. From the perspective of the signing party (Company), this is not a minimum commitment that they must fulfill, but rather a condition that, if not met, allows the counterparty to exit the agreement. This clause does not impose a direct purchasing obligation on the signing party, but rather a performance obligation on the signing party's distribution efforts. While failure to meet this could lead to termination, it doesn't represent a financial minimum commitment risk for the signing party.","HIGH","Sachin","Agreed with Qwen reasoning."
