"row_num","review_id","id","contract","clause_type","clause_text","category","disagreement_type","disagreement_direction","label_gap","clause_risk_profile","typical_risk_for_type","qwen_label","gemini_label","copilot_label","qwen_confidence","gemini_confidence","qwen_reason","gemini_reason","final_label","reviewer","notes"
5199,"MR-172","ALLIANCEBANCORPINCOFPENNSYLVANIA_10_18_2006-EX-1.2-AGENCY AGREEMENT__Post-Termination Services","ALLIANCEBANCORPINCOFPENNSYLVANIA_10_18_2006-EX-1.2-AGENCY AGREEMENT","Post-Termination Services","During the period beginning on the date hereof and ending on the later of the fifth anniversary of the Closing Time or the date on which the Agent receives full payment in satisfaction of any claim for indemnification or contribution to which it may be entitled pursuant to Sections 6 or 7, respectively, none of the Company, the MHCs or the Bank shall, without the prior written consent of the Agent, take or permit to be taken any action that could result in the Bank Common Stock becoming subject to any security interest, mortgage, pledge, lien or encumbrance.","MANUAL_REVIEW","LOW\u2194HIGH","Qwen\u2191",2,"typically MEDIUM \u2014 forced obligations post-contract","LOW (55%)","HIGH","LOW","Medium",0.95,0.9,"The clause imposes a perpetual negative covenant extending until the later of five years or full indemnification payment, effectively freezing the signing party's ability to encumber its primary asset (Bank Common Stock) without the Agent's consent for an indefinite period. This creates significant operational risk and potential liability for the signing party if the Agent withholds consent or if the indemnification claim remains unresolved for an extended time.","This clause imposes a restriction on the Company, MHCs, and the Bank from encumbering Bank Common Stock without the Agent's consent. While it is a post-termination obligation (as the period extends beyond the closing time and potentially until full indemnification payment), it is a standard protective measure for an Agent (likely a lender or indemnified party) to ensure the value of the collateral or the indemnifying party's assets. From the perspective of the Company/Bank (the signing party), it is a common covenant in financing or indemnification agreements and does not introduce unusual or disproportionate risk, especially given the 'prior written consent' mechanism.","LOW","Sachin","Agreed with Gemini reasoning."
5200,"MR-173","ELECTRAMECCANICA VEHICLES CORP. - Manufacturing Agreement__Post-Termination Services","ELECTRAMECCANICA VEHICLES CORP. - Manufacturing Agreement","Post-Termination Services","Upon the termination of this Agreement by either party:","MANUAL_REVIEW","LOW\u2194HIGH","Gemini\u2191",2,"typically MEDIUM \u2014 forced obligations post-contract","LOW (55%)","LOW","HIGH","Medium",0.95,0.7,"The text is a fragmentary introductory phrase that establishes a mutual termination right but contains no substantive post-termination obligations, liabilities, or restrictive covenants that would expose the signing party to risk.","The clause is incomplete and does not specify any post-termination obligations. This lack of detail creates significant uncertainty and potential for unstated or implied obligations, which could be heavily one-sided and disadvantageous to the signing party. Without explicit terms, the signing party is exposed to unknown commitments.","HIGH","Sachin","Agreed with Gemini reasoning."
5201,"MR-174","HEMISPHERX - Sales, Marketing, Distribution, and Supply Agreement__Post-Termination Services","HEMISPHERX - Sales, Marketing, Distribution, and Supply Agreement","Post-Termination Services","Thereafter, HEMISPHERX shall purchase from the SCIEN all remaining stock of Product that is of merchantable quality at the same price as was paid by SCIEN.","MANUAL_REVIEW","LOW\u2194HIGH","Qwen\u2191",2,"typically MEDIUM \u2014 forced obligations post-contract","LOW (55%)","HIGH","LOW","Medium",0.95,1,"The clause imposes a mandatory last-buy obligation on the signing party (HEMISPHERX) to purchase all remaining inventory regardless of market demand or future utility, creating significant financial exposure and potential for forced acquisition of obsolete or unsellable goods.","This clause obligates the drafter (HEMISPHERX) to purchase remaining merchantable stock from the signing party (SCIEN) at the original price. This is favorable to the signing party as it ensures a clear exit strategy for inventory and avoids potential losses on unsold product.","HIGH","Sachin","Agreed with Qwen reasoning."
5202,"MR-175","INNOVIVA,INC_08_07_2014-EX-10.1-COLLABORATION AGREEMENT__Post-Termination Services","INNOVIVA,INC_08_07_2014-EX-10.1-COLLABORATION AGREEMENT","Post-Termination Services","by applicable Laws and regulations.","MANUAL_REVIEW","LOW\u2194HIGH","Qwen\u2191",2,"typically MEDIUM \u2014 forced obligations post-contract","LOW (55%)","HIGH","LOW","Medium",0.3,0.2,"The text is a fragmentary phrase lacking any operative terms, scope, or specific obligations, making it impossible to assess the nature of post-termination duties or protections, creating significant legal uncertainty and potential for unbounded liability exposure.","The provided text is too short to assess any specific post-termination obligations. It only states that something is governed by 'applicable Laws and regulations,' which is a standard and generally favorable or neutral reference. Without further context, there's no specific risk identified for the signing party regarding post-termination services.","HIGH","Sachin","Agreed with Qwen reasoning."
5203,"MR-176","SENMIAOTECHNOLOGYLTD_02_19_2019-EX-10.5-Collaboration Agreement__Post-Termination Services","SENMIAOTECHNOLOGYLTD_02_19_2019-EX-10.5-Collaboration Agreement","Post-Termination Services","After the termination of this Agreement, Party B shall strictly perform the Financial Leasing Agreement signed with the Driver User until the lease expires.","MANUAL_REVIEW","LOW\u2194HIGH","Qwen\u2191",2,"typically MEDIUM \u2014 forced obligations post-contract","LOW (55%)","HIGH","LOW","Medium",0.95,0.9,"The clause imposes an indefinite post-termination obligation to continue performing a separate agreement until its natural expiration, creating significant liability exposure and preventing the signing party from winding down operations or exiting the relationship upon termination of the main contract.","This clause simply states that Party B (the signing party) must continue to fulfill existing obligations under a separate, already-signed agreement (the Financial Leasing Agreement) even after the termination of the current agreement. This is a standard expectation for existing commitments and does not introduce new or unusual post-termination burdens. It ensures continuity for third-party agreements, which is generally a reasonable and expected obligation.","HIGH","Sachin","Agreed with Qwen reasoning."
5204,"MR-177","SmartRxSystemsInc_20180914_1-A_EX1A-6 MAT CTRCT_11351705_EX1A-6 MAT CTRCT_Distributor Agreement__Post-Termination Services","SmartRxSystemsInc_20180914_1-A_EX1A-6 MAT CTRCT_11351705_EX1A-6 MAT CTRCT_Distributor Agreement","Post-Termination Services","Company Obligations. (i) Immediately cease all representation of an existing relationship with Distributor; (ii) All medication inventory is owned by Smart RX Systems, Inc. only; and (iii) Distributor shall continue to receive Net Income per Customer location for so long as Customer continues to utilize the Products.","MANUAL_REVIEW","LOW\u2194HIGH","Qwen\u2191",2,"typically MEDIUM \u2014 forced obligations post-contract","LOW (55%)","HIGH","LOW","Medium",0.95,0.9,"This term creates an indefinite, open-ended financial obligation for the Distributor that persists beyond the termination of the representation relationship. Unlike a standard transition period with a fixed end date, this clause ties ongoing payments to the Customer's future usage without a sunset clause, exposing the Distributor to unlimited liability and preventing a clean financial wind-down.","This clause is favorable to the Distributor (the signing party) as it ensures a continued revenue stream post-termination, tied to customer utilization, which is a significant benefit and not a burden.","MEDIUM","Sachin","REASONING: Even if the term is linked to stock availability, the risk remains Medium because ""utilization"" is a subjective performance trigger that you no longer oversee. Since you must ""cease all representation,"" you cannot verify if the Smart RX Systems medication is truly depleted or if the customer was simply transitioned to a ""new"" product version to cut off your payments.

SIGNALS: ""immediately cease all representation,"" ""for so long as Customer continues to utilize,"" ""medication inventory is owned by Smart RX""

CONTRARY THRESHOLDS:
HIGH: If you were required to pay for the storage or insurance of the medication until it was fully utilized\u2014despite not owning it or being allowed to manage the account\u2014the risk would be High.
LOW: If the payment was a fixed ""Buy-out"" fee paid immediately upon termination, the risk would be Low because it eliminates the need to track stock or customer behavior from the outside."
5205,"MR-178","UsioInc_20040428_SB-2_EX-10.11_1723988_EX-10.11_Affiliate Agreement 2__Post-Termination Services","UsioInc_20040428_SB-2_EX-10.11_1723988_EX-10.11_Affiliate Agreement 2","Post-Termination Services","In  the  event  that this contract between Network 1 and Affiliate is terminated for any reason, the Contractors located by Affiliate  shall  remain  Contractors  of  Network  1.","MANUAL_REVIEW","LOW\u2194HIGH","Qwen\u2191",2,"typically MEDIUM \u2014 forced obligations post-contract","LOW (55%)","HIGH","LOW","Medium",0.95,0.9,"The clause mandates an automatic transfer of the signing party's (Affiliate's) workforce to the drafter (Network 1) upon termination for any reason, stripping the signing party of control over its own resources and potentially forcing unwanted employment relationships or severance liabilities without negotiation.","This clause clarifies that contractors sourced by the Affiliate will remain contractors of Network 1 after termination. From the Affiliate's perspective, this is a low risk as it removes potential post-termination obligations or liabilities related to these contractors, effectively transferring them to Network 1. It does not impose new burdens on the Affiliate.","MEDIUM","Sachin","REASONING: The clause imposes a forced obligation on the Affiliate's contractors to remain with Network 1 upon termination, which could lead to unwanted employment relationships or severance liabilities. However, this risk is mitigated by the fact that the clause does not impose any new burdens on the Affiliate itself.

SIGNALS: In the event that this contract between Network 1 and Affiliate is terminated for any reason, the Contractors located by Affiliate shall remain Contractors of Network 1.

CONTRARY THRESHOLDS:
- HIGH: If the clause stated that the Affiliate would be responsible for paying the contractors' salaries or benefits after termination, that would significantly increase the risk and make it a HIGH risk.
- LOW: If the clause simply stated that the contractors' obligations would cease upon termination, without any mention of them remaining with Network 1, that would be a LOW risk for the Affiliate."
5215,"MR-188","AMERICANPHYSICIANSCAPITALINC_03_31_2003-EX-10.26-AGENCY AGREEMENT__Revenue/Profit Sharing","AMERICANPHYSICIANSCAPITALINC_03_31_2003-EX-10.26-AGENCY AGREEMENT","Revenue/Profit Sharing","Commission will decrease by .5% effective 10/1/99 as part of a repayment program under a project memorandum dated 4/7/99.","MANUAL_REVIEW","LOW\u2194HIGH","Qwen\u2191",2,"typically MEDIUM \u2014 formula determines risk","LOW (50%)","HIGH","LOW","Medium",0.85,0.8,"The clause mandates an automatic reduction in the signing party's commission without specifying a reciprocal benefit, duration limit, or condition for the decrease, creating a significant and unilateral financial exposure that disproportionately benefits the drafter.","The clause indicates a decrease in commission, which, from the perspective of the party receiving the commission, is a negative. However, it explicitly states this is 'as part of a repayment program under a project memorandum dated 4/7/99.' This suggests a pre-agreed arrangement or a specific context where this decrease is expected and understood, rather than an arbitrary or unexpected reduction. Assuming the signing party is aware of and has agreed to the 'repayment program' and 'project memorandum,' this clause simply formalizes a known adjustment. Without further context, it appears to be an implementation of a previously agreed-upon term, making the risk manageable and expected.","LOW","Sachin","Agreed with Gemini reasoning."
5216,"MR-189","EmeraldHealthBioceuticalsInc_20200218_1-A_EX1A-6 MAT CTRCT_11987205_EX1A-6 MAT CTRCT_Development Agreement__Revenue/Profit Sharing","EmeraldHealthBioceuticalsInc_20200218_1-A_EX1A-6 MAT CTRCT_11987205_EX1A-6 MAT CTRCT_Development Agreement","Revenue/Profit Sharing","Dr. Murray will receive an annual royalty on net sales (defined as gross sales minus returns) for any products (the ""Dr. Murray Products"") developed by Dr. Murray for EHN for as long as the Dr. Murray Products are being sold","MANUAL_REVIEW","LOW\u2194HIGH","Gemini\u2191",2,"typically MEDIUM \u2014 formula determines risk","LOW (50%)","LOW","HIGH","Medium",0.9,0.9,"The clause establishes a standard royalty arrangement based on net sales with a duration tied directly to product sales, which is a balanced and common market practice for licensing agreements without imposing unusual liabilities or restrictive covenants on the signing party.","The clause creates an indefinite royalty obligation for the signing party (EHN) for as long as the products are sold, which could be perpetual. This represents a significant long-term financial burden without a clear cap or termination event beyond product discontinuation, which is controlled by EHN. The definition of 'net sales' is also very basic, potentially leaving room for disputes over deductions.","LOW","Sachin","Agreed with Qwen reasoning."
5217,"MR-190","GOOSEHEADINSURANCE,INC_04_02_2018-EX-10.6-Franchise Agreement__Revenue/Profit Sharing","GOOSEHEADINSURANCE,INC_04_02_2018-EX-10.6-Franchise Agreement","Revenue/Profit Sharing","We will receive all Commissions (defined below) from insurance carriers.","MANUAL_REVIEW","LOW\u2194HIGH","Gemini\u2191",2,"typically MEDIUM \u2014 formula determines risk","LOW (50%)","LOW","HIGH","Medium",0,0.9,"The clause explicitly grants the signing party the right to receive all commissions, which is a favorable and standard term for a party providing services or acting as an agent, with no adverse conditions or sharing obligations imposed on them.","This clause explicitly states that the drafting party (referred to as 'We') will receive all commissions, implying that the signing party will not receive any share of these commissions. From the perspective of the signing party, this represents a high risk as it means they are excluded from a potential revenue stream related to the insurance carriers, which could be a significant financial disadvantage depending on the overall business arrangement.","HIGH","Sachin","Agreed with Gemini reasoning."
5218,"MR-191","IntegrityFunds_20200121_485BPOS_EX-99.E UNDR CONTR_11948727_EX-99.E UNDR CONTR_Service Agreement__Revenue/Profit Sharing","IntegrityFunds_20200121_485BPOS_EX-99.E UNDR CONTR_11948727_EX-99.E UNDR CONTR_Service Agreement","Revenue/Profit Sharing","In consideration of the services rendered pursuant to this Agreement, Integrity shall receive the excess, if any, of the sales price, as set forth in the Fund's Registration Statement, over the net asset value of Shares sold by Integrity, as underwriter.","MANUAL_REVIEW","LOW\u2194HIGH","Qwen\u2191",2,"typically MEDIUM \u2014 formula determines risk","LOW (50%)","HIGH","LOW","Medium",0.85,0.9,"The clause creates a one-sided revenue model where the signing party (Integrity) captures all upside sales price appreciation above net asset value, while the counterparty bears the risk of the asset's valuation and potential loss of value, creating a disproportionate benefit to the drafter.","This clause describes the compensation structure for Integrity as an underwriter, where they receive the difference between the sales price and the net asset value of shares they sell. This is a standard and expected compensation model for an underwriter, representing their commission or spread. From the perspective of the counterparty (the Fund), this is a clear and typical cost of engaging an underwriter, not an unusual or disproportionate risk.","LOW","Sachin","Agreed with Gemini reasoning."
5219,"MR-192","SYKESHEALTHPLANSERVICESINC_04_24_1998-EX-10.14-OUTSOURCING AGREEMENT__Revenue/Profit Sharing","SYKESHEALTHPLANSERVICESINC_04_24_1998-EX-10.14-OUTSOURCING AGREEMENT","Revenue/Profit Sharing","HPS will pay to SHPS all Care Management Revenues collected from such New Client, and SHPS will pay a commission to HPS equal to five percent (5%) of such amount received by SHPS from HPS pursuant to this Section 2.4.","MANUAL_REVIEW","LOW\u2194HIGH","Qwen\u2191",2,"typically MEDIUM \u2014 formula determines risk","LOW (50%)","HIGH","LOW","Medium",0.95,0.9,"The signing party (HPS) is required to remit 100% of the revenue collected from new clients to the counterparty (SHPS), creating a total loss of revenue stream for the signing party while only receiving a small 5% commission in return. This term is heavily one-sided and effectively transfers all commercial value to the counterparty.","As the signing party (SHPS), this clause outlines a clear and specific commission payment of 5% to HPS. This is a defined cost of doing business under this agreement, and the percentage is not unusually high for a commission structure. The mechanism for payment is also clear, reducing ambiguity.","MEDIUM","Sachin","REASONING: The clause imposes a significant revenue stream transfer from HPS to SHPS, but the commission payment of 5% is capped and specific. This mitigates the risk, making it manageable for HPS.

SIGNALS: HPS will pay to SHPS all Care Management Revenues collected, SHPS will pay a commission to HPS equal to five percent (5%)

CONTRARY THRESHOLDS:
- HIGH: If the clause didn't specify a percentage-based commission and instead allowed SHPS to negotiate a custom rate for each new client, it would be an unmanageable trap for HPS. The lack of caps or limits would create uncertainty and potentially catastrophic financial implications.
- LOW: If the clause only allowed HPS to receive a flat fee per new client, without any percentage-based commission, it would be a commercially standard and safe arrangement. The lack of revenue stream transfer would eliminate the risk."
5221,"MR-194","HEALTHGATEDATACORP_11_24_1999-EX-10.1-HOSTING AND MANAGEMENT AGREEMENT (1)__Source Code Escrow","HEALTHGATEDATACORP_11_24_1999-EX-10.1-HOSTING AND MANAGEMENT AGREEMENT (1)","Source Code Escrow","HealthGate and the Publishers shall enter and maintain in force the             Escrow Agreement for such period as the Publishers require.","MANUAL_REVIEW","LOW\u2194HIGH","Qwen\u2191",2,"typically LOW-MEDIUM \u2014 access conditions matter","LOW (50%)","HIGH","LOW","Medium",0.9,0.9,"The duration of the escrow obligation is entirely discretionary and controlled by the counterparty (Publishers), creating an indefinite and potentially perpetual liability for the signing party (HealthGate) without a defined termination date or objective criteria for ending the requirement.","From the perspective of the signing party (Publishers), this clause is favorable as it mandates HealthGate to enter and maintain an escrow agreement for as long as the Publishers require. This provides the Publishers with the protection of source code escrow, which is a beneficial term for a licensee or customer.","HIGH","Sachin","Agreed with Qwen reasoning."
5222,"MR-195","INKTOMICORP_06_08_1998-EX-10.14-SOFTWARE HOSTING AGREEMENT__Source Code Escrow","INKTOMICORP_06_08_1998-EX-10.14-SOFTWARE HOSTING AGREEMENT","Source Code Escrow","Inktomi will direct the Escrow Agent to release to Microsoft all Confidential Materials held by the Escrow Agent, subject to Microsoft's agreement to use such Confidential Materials only in connection with its licensed rights under clause (iv) above;","MANUAL_REVIEW","LOW\u2194HIGH","Qwen\u2191",2,"typically LOW-MEDIUM \u2014 access conditions matter","LOW (50%)","HIGH","LOW","Medium",0.85,0.9,"The clause mandates the unconditional release of all confidential materials to the counterparty (Microsoft) upon a trigger event, without limiting the release to source code necessary for maintenance or restricting the scope to the specific licensed rights. This creates a significant risk of over-disclosure of proprietary information beyond what is strictly required for the escrow purpose, potentially exposing the signing party to broader IP leakage than intended.","This clause describes the release of escrowed materials to Microsoft (the signing party) upon certain conditions, which is a benefit to Microsoft. The condition to use the materials only in connection with licensed rights is standard and expected for escrowed source code.","MEDIUM","Sachin","REASONING: This clause triggers a ""Physical Transfer of IP,"" where Microsoft gains direct possession of Inktomi's proprietary source code or trade secrets. While the use is restricted to ""licensed rights,"" the risk is elevated because once the ""Confidential Materials"" leave the neutral escrow agent and enter Microsoft's internal environment, Inktomi loses technical control over how that data is copied, viewed, or protected.

SIGNALS: ""release to Microsoft,"" ""all Confidential Materials,"" ""subject to Microsoft's agreement""

CONTRARY THRESHOLDS:
HIGH: The risk would be High if the release happened automatically upon a minor ""contract dispute"" rather than a catastrophic ""company failure"" (like bankruptcy), as Microsoft could gain your core tech while you are still actively competing.
LOW: The risk would be Low if the clause required Microsoft to use the materials only on a ""clean room"" basis or mandated an independent third-party audit to prove the materials were deleted after use."
5223,"MR-196","SUMMAFOURINC_06_19_1998-EX-10.3-SOFTWARE LICENSE AND MAINTENANCE AGREEMENT__Source Code Escrow","SUMMAFOURINC_06_19_1998-EX-10.3-SOFTWARE LICENSE AND MAINTENANCE AGREEMENT","Source Code Escrow","The following events shall constitute ""Source Code Access Conditions"": (i) D2's insolvency, general assignment for the benefit of creditors, or ceasing to do business, or (ii) D2's failure or inability to meet its warranty, maintenance and support obligations under Article 6, or its warranty obligations under Article 8.3, within fifteen days after written notice by LICENSEE to D2 of D2's failure to meet such obligations, or (iii) termination of this Agreement by LICENSEE pursuant to Articles 9.3 and 9.4, or (iv) as needed by LICENSEE for fault isolation.","MANUAL_REVIEW","LOW\u2194HIGH","Qwen\u2191",2,"typically LOW-MEDIUM \u2014 access conditions matter","LOW (50%)","HIGH","LOW","Medium",0,0.95,"The inclusion of 'as needed by LICENSEE for fault isolation' as a trigger for source code release creates an undefined, subjective condition that allows the LICENSEE to access the source code at any time without objective criteria or notice, effectively bypassing the protections of a standard escrow arrangement and granting the signing party (D2) no control over when their intellectual property is released.","This clause provides the LICENSEE (signing party) with multiple, clear conditions under which they can access the source code, including standard insolvency events, failure to meet obligations, termination by the LICENSEE, and for fault isolation. These are favorable and protective terms for the LICENSEE, ensuring access when critical for business continuity or problem resolution.","LOW","Sachin","Agreed with Gemini reasoning."
5224,"MR-197","TRICITYBANKSHARESCORP_05_15_1998-EX-10-OUTSOURCING AGREEMENT__Source Code Escrow","TRICITYBANKSHARESCORP_05_15_1998-EX-10-OUTSOURCING AGREEMENT","Source Code Escrow","M&I shall be responsible for the cost of maintaining and updating the source code escrow including any fees to be





paid to DSI.","MANUAL_REVIEW","LOW\u2194HIGH","Qwen\u2191",2,"typically LOW-MEDIUM \u2014 access conditions matter","LOW (50%)","HIGH","LOW","Medium",0.95,0.9,"The signing party (M&I) bears the full financial burden for escrow maintenance and fees, which is a significant and unusual liability for a customer or licensee who typically expects the software vendor to fund this protection mechanism.","This clause explicitly states that the counterparty (M&I) is responsible for the costs associated with the source code escrow. From the perspective of the signing party (the party receiving the benefit of the escrow), this is a favorable term as it shifts the financial burden of maintaining the escrow to the other party. This reduces the signing party's operational costs and ensures the escrow is maintained without direct expense to them.","LOW","Sachin","Agreed with Gemini reasoning."
